{
  "$schema": "./_meta.json",
  "id": "steps",
  "consume": {
    "css": "@skryensya/core/components/steps.css",
    "prefer": "react"
  },
  "surfaces": {
    "Steps": {
      "use": "progress across an ordered sequence of stages",
      "element": "ol",
      "react": {
        "from": "@skryensya/react/steps",
        "name": "Steps"
      },
      "requires": ["steps"]
    }
  },
  "rules": {
    "steps": "Give every step a label; description is optional supporting text.",
    "status": "Give a step its own status to override the derived one, otherwise Steps derives complete/current/upcoming from current, the zero-based index of the active step.",
    "ownership": "Steps only displays the sequence; the caller owns which step is current and any navigation between them.",
    "static": "A sequence with no progress state, just numbered instructions, is a ProcessList instead."
  },
  "examples": {
    "Steps": {
      "basic": "<Steps current={1} steps={[{ label: \"Cuenta\" }, { label: \"Envío\" }, { label: \"Pago\" }]} />",
      "explicit": "<Steps steps={[{ label: \"Cuenta\", status: \"complete\" }, { label: \"Envío\", status: \"current\" }, { label: \"Pago\", status: \"upcoming\" }]} />"
    }
  }
}
