{
  "$schema": "./_meta.json",
  "id": "icon",
  "consume": {
    "css": "@skryensya/core/patterns/icon.css",
    "prefer": "react"
  },
  "surfaces": {
    "Icon": {
      "use": "glyph",
      "element": "svg",
      "react": {
        "from": "@skryensya/react/icon",
        "name": "Icon"
      }
    },
    "IconSetProvider": {
      "use": "bind an icon set for a subtree",
      "element": "context",
      "react": {
        "from": "@skryensya/react/icon",
        "name": "IconSetProvider"
      }
    }
  },
  "props": {
    "size": ["md", "sm", "lg"]
  },
  "meanings": {
    "size": {
      "sm": "inline with dense text or a sm control",
      "md": "default, matches a md control",
      "lg": "standalone or hero placement"
    }
  },
  "rules": {
    "name": "A stable role from the linked set (e.g. \"close\", \"chevron-down\"), portable across a set swap. Use this, not data, unless the geometry is project-specific.",
    "label": "Omit when the icon sits inside a control that already has an accessible name (a labelled Button, text beside it): the icon stays decorative (aria-hidden). Set label only when the icon stands alone and means something by itself — that makes it content (role=\"img\").",
    "IconSetProvider": "Default set is Phosphor; wrap a subtree in IconSetProvider to bind lucide or material instead. Only the set actually imported ships in the bundle.",
    "data": "Use the data prop instead of name for project-specific geometry that isn't part of the portable stable vocabulary; data and name are mutually exclusive."
  },
  "examples": {
    "Icon": {
      "decorative": "<Icon name=\"close\" />",
      "standalone": "<Icon name=\"warning\" label=\"Warning\" />",
      "sized": "<Icon name=\"chevron-down\" size=\"sm\" />"
    },
    "IconSetProvider": {
      "boundSet": "<IconSetProvider set={lucideIcons}><Icon name=\"close\" /></IconSetProvider>"
    }
  }
}
