{
  "$schema": "./_meta.json",
  "id": "tooltip",
  "consume": {
    "css": "@skryensya/core/components/tooltip.css",
    "prefer": "react",
    "vanilla": {
      "classes": ["sk-tooltip"],
      "attributes": ["data-sk-anchor"]
    }
  },
  "surfaces": {
    "Tooltip": {
      "use": "auxiliary description for a control that already has its own accessible name",
      "element": "span",
      "react": {
        "from": "@skryensya/react/tooltip",
        "name": "Tooltip"
      },
      "requires": ["content"]
    }
  },
  "props": {
    "placement": ["block-start", "block-end", "inline-start", "inline-end"],
    "interactive": [false, true],
    "arrow": [false, true]
  },
  "meanings": {
    "placement": {
      "block-start": "opens above the trigger, the tooltip default",
      "block-end": "opens below when the space above is tight",
      "inline-start": "opens toward the start edge, alongside the trigger",
      "inline-end": "opens toward the end edge, alongside the trigger"
    },
    "interactive": {
      "true": "the pointer can move into the tooltip without it closing, required for WCAG 1.4.13 hoverable content",
      "false": "closes as soon as the pointer leaves the trigger; only turn off knowingly"
    }
  },
  "rules": {
    "children": "The child control must already carry its own accessible name (visible text or aria-label); the tooltip only extends it, it never replaces aria-labelledby.",
    "content": "Keep content short: a tooltip is a hint, never the only place information lives, since it never opens on touch and never appears without JS.",
    "interactive": "Leave interactive on unless you have measured that the content never needs to be read by pointer."
  },
  "examples": {
    "Tooltip": {
      "icon-only": "<Tooltip content=\"Exportar el periodo visible en CSV\"><Button aria-label=\"Exportar\" iconOnly variant=\"ghost\"><DownloadIcon /></Button></Tooltip>",
      "placement": "<Tooltip arrow content=\"Texto completo truncado arriba\" placement=\"inline-end\">Billing pipeline migration</Tooltip>"
    }
  },
  "children": ["Button"],
  "composes": {
    "Button": {
      "from": "@skryensya/react/button",
      "name": "Button"
    }
  }
}
